{
  "apiVersion": "platform.yourown/v1alpha1",
  "kind": "Release",
  "workloadRef": "workload://example-api",
  "environmentRef": "environment://sandbox",
  "imageDigest": "sha256:abababababababababababababababababababababababababababababababab",
  "configurationSHA256": "c22153d66543b0f606fd3d40208d2d97a34831c1ed8b8d75c32b678a8ada8690",
  "sourceCommit": "abababababababababababababababababababab"
}
